{
  "$schema": "https://json-schema.org/draft/2020-12/schema",
  "$id": "https://schemas.chronicle.dev/v1/envelope.json",
  "title": "envelope",
  "type": "object",
  "properties": {
    "v": {
      "type": "integer",
      "minimum": 1,
      "maximum": 9007199254740991
    },
    "id": {
      "type": "string",
      "pattern": "^evt_[0-9A-HJKMNP-TV-Z]{26}$"
    },
    "ts": {
      "type": "string",
      "pattern": "^\\d{4}-\\d{2}-\\d{2}T\\d{2}:\\d{2}:\\d{2}\\.\\d{3}Z$"
    },
    "type": {
      "type": "string",
      "minLength": 1
    },
    "session": {
      "type": "string",
      "pattern": "^ses_[0-9A-HJKMNP-TV-Z]{26}$"
    },
    "actor": {
      "type": "object",
      "properties": {
        "kind": {
          "type": "string",
          "enum": [
            "human",
            "agent",
            "system"
          ]
        },
        "provider": {
          "type": "string",
          "minLength": 1
        },
        "model": {
          "type": "string",
          "minLength": 1
        }
      },
      "required": [
        "kind"
      ],
      "additionalProperties": {}
    },
    "git": {
      "type": "object",
      "properties": {
        "head": {
          "anyOf": [
            {
              "type": "string",
              "pattern": "^[0-9a-f]{7,40}$"
            },
            {
              "type": "null"
            }
          ]
        },
        "branch": {
          "anyOf": [
            {
              "type": "string",
              "minLength": 1
            },
            {
              "type": "null"
            }
          ]
        },
        "dirty": {
          "type": "array",
          "items": {
            "type": "string",
            "minLength": 1
          }
        }
      },
      "required": [
        "head",
        "branch",
        "dirty"
      ],
      "additionalProperties": {}
    },
    "payload": {},
    "meta": {
      "type": "object",
      "properties": {
        "provider": {
          "type": "string",
          "minLength": 1
        },
        "workspace": {
          "type": "string",
          "pattern": "^wks_[0-9A-HJKMNP-TV-Z]{26}$"
        },
        "schema": {
          "type": "string",
          "pattern": "^[A-Za-z][A-Za-z0-9.-]*\\/[1-9][0-9]*$"
        },
        "visibility": {
          "type": "string",
          "enum": [
            "shared",
            "local"
          ]
        }
      },
      "required": [
        "provider",
        "workspace",
        "schema",
        "visibility"
      ],
      "additionalProperties": {}
    }
  },
  "required": [
    "v",
    "id",
    "ts",
    "type",
    "actor",
    "git",
    "payload",
    "meta"
  ],
  "additionalProperties": {}
}
