{
  "v": 1,
  "id": "evt_01ARZ3NDEKTSV4RRFFQ69G5F09",
  "ts": "2026-07-14T10:32:11.412Z",
  "type": "FileModified",
  "session": "ses_01ARZ3NDEKTSV4RRFFQ69G5F34",
  "actor": {
    "kind": "agent",
    "provider": "example-tool",
    "model": "example-model-1"
  },
  "git": {
    "head": "9fc1b2a",
    "branch": "feat/auth",
    "dirty": [
      "src/auth.ts"
    ]
  },
  "payload": {
    "paths": [
      "src/auth/refresh.ts"
    ]
  },
  "meta": {
    "provider": "example-tool@1.0.0",
    "workspace": "wks_01ARZ3NDEKTSV4RRFFQ69G5F35",
    "schema": "FileModified/1",
    "visibility": "shared"
  }
}
