{
  "v": 1,
  "id": "evt_01ARZ3NDEKTSV4RRFFQ69G5F0K",
  "ts": "2026-07-14T10:32:11.412Z",
  "type": "CaptureDegraded",
  "session": "ses_01ARZ3NDEKTSV4RRFFQ69G5F34",
  "actor": {
    "kind": "system"
  },
  "git": {
    "head": "9fc1b2a",
    "branch": "feat/auth",
    "dirty": [
      "src/auth.ts"
    ]
  },
  "payload": {
    "provider": "example-tool",
    "fromTier": 1,
    "toTier": 2,
    "reason": "log format fingerprint mismatch"
  },
  "meta": {
    "provider": "example-tool@1.0.0",
    "workspace": "wks_01ARZ3NDEKTSV4RRFFQ69G5F35",
    "schema": "CaptureDegraded/1",
    "visibility": "local"
  }
}
