{
  "v": 1,
  "id": "evt_01ARZ3NDEKTSV4RRFFQ69G5F03",
  "ts": "2026-07-14T10:32:11.412Z",
  "type": "SessionEnded",
  "session": "ses_01ARZ3NDEKTSV4RRFFQ69G5F34",
  "actor": {
    "kind": "system"
  },
  "git": {
    "head": "9fc1b2a",
    "branch": "feat/auth",
    "dirty": [
      "src/auth.ts"
    ]
  },
  "payload": {
    "reason": "completed"
  },
  "meta": {
    "provider": "example-tool@1.0.0",
    "workspace": "wks_01ARZ3NDEKTSV4RRFFQ69G5F35",
    "schema": "SessionEnded/1",
    "visibility": "shared"
  }
}
